data_id,iso,event_id_cnty,event_id_no_cnty,event_date,year,time_precision,event_type,sub_event_type,actor1,assoc_actor_1,inter1,actor2,assoc_actor_2,inter2,interaction,region,country,admin1,admin2,admin3,location,latitude,longitude,geo_precision,source,source_scale,fatalities,timestamp,notes,URL,text,date_publish,event_type_635,textrank,actor1_635
5076373,356,IND48534,48534,23-Mar-19,2019,1,Riots,Mob violence,Rioters (India),Barapokhari Communal Group (India),5,Rioters (India),Bibinagar Communal Group (India),5,55,Southern Asia,India,Odisha,Bhadrak,Basudebpur,Basudebpur,21.1197,86.729,2,Odisha Sun Times,Subnational,0,1553639133,"On 23 March, to groups of villagers - from Barapokhari and Bibinagar - clashed in Basudevpur area (Bhadrak, Odisha) over a dispute involving a newly-wed woman, who had gone to her parental house at Barapokhari, not return for the night to her in-law's house at Bibinagar. The police temporarily arrested members from both sides. [size=no report]",https://odishasuntimes.com/11-arrested-for-sundays-arson-in-odisha-village/,"Odisha Sun Times Bureau Brahmapur, Mar 23 Police today arrested 11 persons in connection with yesterday s group clash in Ambagaon under Jarada police limits in Odisha s Ganjam district. While three persons have sustained injuries in yesterday s group clash, over 40 houses were set ablaze as rival groups set afire thatched houses belonging to the other group and hurled bombs at each other. One seriously injured person has been referred to a hospital at Visakhapatnam while other two are undergoing treatment at Jarada hospital, police said. All male members of the village, which has around 90 households, have fled after the incident fearing arrest. DIG southern range Amitav Thakur who was on a visit to the strife torn village said The situation is now under control. SDPO Chikiti and IIC Jarada are camping in the village to maintain peace. Raids were conducted in different places to nab other persons involved in the incident, said SP Sarthak Sarangi. District administration has provided polythene sheets and food to the families, who had been rendered homeless in the arson, said Prem Chandra Choudhury collector Ganjam. There is old enmity between the groups, but the provocation for the fresh incident is not known and is being investigated, police said.",3/23/15 20:26,Protests,"['incident', 'Jarada', 'village', 'persons', 'police', 'group', 'groups', 'Odisha']",Protesters (India)
5076382,356,IND48544,48544,23-Mar-19,2019,1,Riots,Mob violence,Rioters (India),,5,Civilians (India),,7,57,Southern Asia,India,Assam,Kamrup,Rangia,Rangia,26.4373,91.6197,2,Time8,Subnational,0,1553639133,"On March 23, villagers vandalized the house of a man in Rangia area (Kamrup, Assam), after he stabbed to death another villager over a family dispute. The locals also set his car ablaze along with two motorbikes, furniture and other items in the house. [size=no report]",https://www.time8.in/man-stabbed-to-death-in-kamrup-angry-mob-vandalizes-accuseds-house-burns-vehicle/,"ABHIJIT TALUKDAR Tamulpur, March 23, 2019 Tension gripped Kamrup district after a man was stabbed to death on March 23rd, 2019. The accused identified as Rizul Ali was at loggerheads with the deceased Afiz Ali over a family dispute. The villagers had called a meeting on March 23rd, 2019 to solve the dispute when the Rizul stabbed Afiz to death owing to disagreements. Afiz was rushed to the hospital but he succumbed to his injuries. Post the death of Afiz, the angry mob vandalized the house of Rizul and also set his car ablaze along with two motorbikes, furniture and other items in the house. The mob also vandalized the house of a family which was trying to protect the accused. As per reports, Kamrup Superintendent of Police along with Rangia Sub Divisional Police Office reached the spot to cool the irate crowd. As per police, Rizul is a dreaded criminal. Locals demanded strict action against the culprit.",3/23/19 13:42,Riots,"['Afiz', 'Ali', 'Police', 'Rizul', 'March', 'death', 'family', 'house']",Rioters (India)
5076383,356,IND48545,48545,23-Mar-19,2019,1,Riots,Mob violence,Rioters (India),BJP: Bharatiya Janata Party,5,Civilians (India),CPI(M): Communist Party of India (Marxist),7,57,Southern Asia,India,Tripura,Dhalai,Kamalpur,Kamalpur,24.1969,91.8334,1,Tripura Infoway,Subnational,0,1553639133,"On March 23, BJP supporters attacked 10 CPI-M workers in Manikbhander area in Kamalpur city (Dhalai, Tripura), as they were conducting a meeting in the party office. [size=no report]",http://www.tripurainfoway.com/news-details/TN/125296/10-cpi-m-supporters-injured-after-mp-jiten-successfully-opened-bjp-occupied-kamalpur-cpi-m-party-office.html,"Tripura News 10 CPI M supporters injured after MP Jiten successfully opened BJP occupied Kamalpur CPI M Party office TIWN March 23, 2019 AGARTALA, March 23 TIWN Tension hits Kamalpur after MP Jitendra Chaudhury successfully opened Kamalpur party office of CPI M after 11 months. Centering this office opening multiple attacks came upon CPI M in previous days, which came in media reports. However, today ahead of Lok Sabha Election, this office was opened and a meeting led by MP Jitendra Chaudhury was held, but amid model code of conduct BJP hooligans led massive attack on CPI M. Party source said that amid hooligans threat MP Jitendra Chaudhury went in Kamalpur and opened the office. But, after that BJP goons attacked 10 CPI M supporters in Manikbhander, Kamalpur whereas police remained as mute spectator. SP Dhalai remained as mute spectator of the incident. CPI M said, the administration was functioning as BJP s puppet. At around, 10 am Jitendra Chaudhury reached the spot but BJP goons in front of SDPO held the attack. MP Jitendra Choudhury then contacted SP Dhalai but no development came. CPI M will inform Election Commission about this Police Administration s failure.",,Protests,"['M', 'CPI', 'Kamalpur', 'BJP', 'MP', 'Jitendra', 'office', 'Election']",Protesters (India)
5076378,356,IND48540,48540,23-Mar-19,2019,1,Protests,Peaceful protest,Protesters (India),Students (India),6,,,0,60,Southern Asia,India,Jammu and Kashmir,Doda,Gandoh,Gandoh,33.0322,75.9096,2,Daily Excelsior,Subnational,0,1553639133,"On 23 Mar, students from the government high school staged a protest in the Gandoh tehsil area (Doda, J&K) against a shortage of teachers at their school. [size=no report]",http://www.dailyexcelsior.com/students-protest-against-shortage-of-teachers-4/,"Excelsior Correspondent DODA, Mar 23 The students of Government High School Tilogra in Sub Division Gandoh today staged protest against the shortage of teachers in their school. The students raised slogans against the Education Department and also held Government equally responsible against shortage of teaching staff in their school, wherein students of remote areas also pursue their education. Amid slogans, the protesting students blocked the vehicular movement on the Gandoh Thathri Doda road at Malikpura. They were demanding adequate teaching staff in their school. The protesting students informed that there was no class work in the school due to non availability of the adequate teaching staff. Due to shortage of teaching staff, our studies are suffering , they added. Later, SDM Gandoh Pritam Lal Thapa reached the spot and assured the students of taking up their demand with the Education Department for redressal. On the assurance, the protesting students dispersed.",3/23/19 21:35,Protests,"['students', 'Gandoh', 'Government', 'school', 'shortage', 'teaching', 'staff', 'Division']",Protesters (India)
5076372,356,IND48533,48533,23-Mar-19,2019,1,Riots,Mob violence,Rioters (India),Bibinagar Communal Group (India),5,Police Forces of India (2014-),,1,15,Southern Asia,India,Odisha,Bhadrak,Basudebpur,Basudebpur,21.1197,86.729,2,Odisha Sun Times,Subnational,0,1553639133,"On 23 March, a group of villagers from Bibinagar attacked and vandalised Kasia Marine police station in Basudevpur (Bhadrak, Odisha) alleging inaction of the cops in connection with a dispute between two families. [size=no report]",https://odishasuntimes.com/section-144-clamped-in-jeypore-following-group-clash/,"Jeypore The Koraput district administration today prohibitory orders under Section 144 of CrPC following a group clash between two villages under Sadar police limits in Koraput district. Sources said four platoons of BSF personnel and three platoons of police force have been deployed in the area to avoid any untoward incident. Besides, district SP KV Singh, IPS Sagarika Nath and four Inspectors In charges IICs have also been engaged in the locality. A flag march will be conducted in the sensitive area. Yesterday, a clash broke out between two groups of Dhepaguda and kundariguda villages over past enmity while they had gone to a nearby canal to take bath after celebrating Holi. Several persons from both the groups were injured due to stone pelting during the clash. When the situation went out of control, police reached the spot and opened blank fires to disperse the mob. Besides, vehicular traffic on NH 26 was disrupted for over two hours due to the clash.",3/23/19 11:30,Protests,"['police', 'clash', 'groups', 'district', 'Dhepaguda', 'platoons', 'villages', 'area']",Protesters (India)
5076374,356,IND48535,48535,23-Mar-19,2019,2,Protests,Peaceful protest,Protesters (India),INC: Indian National Congress,6,,,0,60,Southern Asia,India,Odisha,Jharsuguda,Jharsuguda,Jharsuguda,21.8543,84.0108,1,Odisha Sun Times,Subnational,0,1553639133,"Assumed on 23 March, Congress workers locked up the INC party office at Jharsuguda city (Odisha), protesting against the ticket distribution for the upcoming assembly polls. [size=no report]",https://odishasuntimes.com/congress-bhawan-ransacking-in-odisha-7-arrested/,"Bhubaneswar The Commissionerate Police arrested six persons today in connection with vandalism in Congress Bhawan. The police took Sk. Amir Mohammad, Sabir Mohammad, Latifur Rahman, Sajir Khanm Hadaqat Khan, Sayed Tafiq and Biswa Ranjan Khatei into custody today for damaging property at Odisha Congress headquarters in Bhubaneswar on Mar 23. According to police reports, the arrested individuals are neither Congress workers nor ticket aspirants of upcoming polls. Watch video Congress Bhawan vandalised in Odisha capital The miscreants resorted to sabotage on the premises of Congress Bhawan and later locked its gate protesting the decision of the party to allot the ticket for Ekamra Bhubaneswar Assembly seat to Rashmirekha Mohapatra in the impending elections. Following the incident, Odisha Congress filed a complaint in Capital police station. The accused have been forwarded to court, police sources said.",3/26/19 17:46,Protests,"['Congress', 'Bhubaneswar', 'police', 'Bhawan', 'ticket', 'today', 'Mohammad', 'Rahman']",Protesters (India)